Code;Título;Tempo inicial;Tipo;Situação;Link;Vídeo base
v346;Tem cliente que só merece o Tião;;Reels;Enviado;https://drive.google.com/open?id=1bFvJIZ7QoOOgGP-YT_BQhs85qmCM-Ut0&authuser=f215775%40dac.unicamp.br&usp=drive_fs;Mensagem WhatsApp - Laiô
v347;Faz só o projeto? Só o Laiôôô?;;Reels;Enviado;https://drive.google.com/open?id=1bI-4rMnkvQwh9bZkz0FNh6zHupyBwktT&authuser=f215775%40dac.unicamp.br&usp=drive_fs;Mensagem WhatsApp - Laiô
v348;Não seja o falecido marcelo 🥺;;Reels;Enviado;https://drive.google.com/open?id=1bK3QDpiW6IcfDErd77CdOIAtgJifx4eP&authuser=f215775%40dac.unicamp.br&usp=drive_fs;Mensagem WhatsApp - Laiô
v367;Homenagem Paulo Gustavo;;IGTV;Enviado;https://drive.google.com/open?id=1V31LuWWZ1n4gOhu5_KdrX9V1nb4EXsxm&authuser=f215775%40dac.unicamp.br&usp=drive_fs;Poema dos stories
v403;Os 3 motivos porque você não lucra projetando com Sket + CAD ou Sket + Layout;;IGTV;Enviado;https://drive.google.com/open?id=1RAkY8QmekRWgqonf1ZluiPBvNEtNwuv0&authuser=f215775%40dac.unicamp.br&usp=drive_fs;Stories
v328;É Por isso que voce consegue PROJETAR 5x mais rápido usando nosso Template CHORA CAD!;19:33 – 21:28;Feed;Enviado;https://drive.google.com/open?id=1Q-08h8dMMr9QPnEDe13fn-ErbGavcIOz&authuser=f215775%40dac.unicamp.br&usp=drive_fs;Live 26/01 - Por Dentro do Chora I
v329;VOCE NÃO VENDE PROJETO DE INTERIORES, VOCE VENDE ISSO!;22:43 – 23:18;Reels;Enviado;https://drive.google.com/open?id=1RDCJipkCgPUWWWEvt9jdBYWLtfamUKlQ&authuser=f215775%40dac.unicamp.br&usp=drive_fs;Live 26/01 - Por Dentro do Chora I
v330;São esses recursos do CHORA que te permite concluir um projeto em 2, 3 dias!;24:44 – 25:16;Reels;Enviado;https://drive.google.com/open?id=1RkedhmmtHRxH45lQN77ovVMEADyJ7nJk&authuser=f215775%40dac.unicamp.br&usp=drive_fs;Live 26/01 - Por Dentro do Chora I
v331;É por esse motivo que ao usar nosso template  CHORA Cad  seu computador não trava!! ;27:16 – 27:54,  28:56 – 30:11, 32:24 – 34:09;IGTV;Enviado;https://drive.google.com/open?id=1S4wWhlXipHon8NnW51u1FD0tYGuBypES&authuser=f215775%40dac.unicamp.br&usp=drive_fs;Live 26/01 - Por Dentro do Chora I
v332;Quando voce divide o projeto dessa forma seus arquivos ficam muito MAIS LEVES!;38:30 – 39:29;Feed;Enviado;https://drive.google.com/open?id=1_nAOVrbQ-VS_5WyLb5SbLOmugqz3t-1C&authuser=f215775%40dac.unicamp.br&usp=drive_fs;Live 26/01 - Por Dentro do Chora I
v333;É dessa forma que varias pessoas projetam ao mesmo tempo no mesmo modelo usando o CHORA!;39:30 – 40:20, 40:43 – 43:20;IGTV;Enviado;https://drive.google.com/open?id=1TnrWDRAgNv2zM2kvJLezwvTXEMde57RB&authuser=f215775%40dac.unicamp.br&usp=drive_fs;Live 26/01 - Por Dentro do Chora I
v334;Voce ainda aproveita pedaços de desenhos de outros projetos? Então está usando a Ferramenta ERRADA! ;46:32 – 47:27;Feed;Enviado;https://drive.google.com/open?id=1_ojweW_cD89vgldY_EAt5poqOUQ0Hx4e&authuser=f215775%40dac.unicamp.br&usp=drive_fs;Live 26/01 - Por Dentro do Chora I
v335;Todo profissional de INTERIORES precisa saber  disso. Voce já sabe?;48:19 – 49:27;Feed;Enviado;https://drive.google.com/open?id=1Ur5NsZmVlBeevjNUQHH-DV1IKYYkk1XG&authuser=f215775%40dac.unicamp.br&usp=drive_fs;Live 26/01 - Por Dentro do Chora I
v336;Trabalha com INTERIORES  e Não sabe quanto custa sua HORA? Assista esse vídeo!;01:01:25 – 01:02:16;Reels;Enviado;https://drive.google.com/open?id=1VEMpTnbBnP9NItCH0fYlhtu7yzJZLdsE&authuser=f215775%40dac.unicamp.br&usp=drive_fs;Live 26/01 - Por Dentro do Chora I
v337;Se voce não incluiu estas atividades no valor do seu projeto, SAIU no PREJUIZO!;01:06:24 – 01:06:47;Reels;Enviado;https://drive.google.com/open?id=1VgvYGTXV9yMpzi1Ght9e2xcZnyag3w7Z&authuser=f215775%40dac.unicamp.br&usp=drive_fs;Live 26/01 - Por Dentro do Chora I
v338;Essa é a porcentagem que cobramos para cada etapa do projeto de Interiores!;01:09:54 – 01:10:45;Feed;Enviado;https://drive.google.com/open?id=1_pVcbbgvXUP-c8krn1dodmiwDWo01v7i&authuser=f215775%40dac.unicamp.br&usp=drive_fs;Live 26/01 - Por Dentro do Chora I
v339;É assim que você cobra o cliente que rescinde o projeto no meio do contrato!;01:11:58 – 01:12:32, 01:09:54 – 01:10:45;IGTV;Enviado;https://drive.google.com/open?id=1WUj2FpmTOoTlouZpY6nl5DTMU2ltWY9K&authuser=f215775%40dac.unicamp.br&usp=drive_fs;Live 26/01 - Por Dentro do Chora I
v340;É assim que voce ganha o cliente na apresentação de PROPOSTA do seu projeto de interiores!;01:30:35 – 01:32:48;IGTV;Enviado;https://drive.google.com/open?id=1X2n07H_1lUxb16dbupSCxeMEwjTftc00&authuser=f215775%40dac.unicamp.br&usp=drive_fs;Live 26/01 - Por Dentro do Chora I
av328;É Por isso que voce consegue PROJETAR 5x mais rápido usando nosso Template CHORA CAD!;Áudio;Feed;Enviado;https://drive.google.com/open?id=1QbrJYb-8GTGlS02L86zVA4pUxTAyks3j&authuser=f215775%40dac.unicamp.br&usp=drive_fs;Live 26/01 - Por Dentro do Chora I
av329;VOCE NÃO VENDE PROJETO DE INTERIORES, VOCE VENDE ISSO!;Áudio;Reels;Enviado;https://drive.google.com/open?id=1Rg3KBs95BLGMq1Bl-5jWJ42v0-rgW2fO&authuser=f215775%40dac.unicamp.br&usp=drive_fs;Live 26/01 - Por Dentro do Chora I
av330;São esses recursos do CHORA que te permite concluir um projeto em 2, 3 dias!;Áudio;Reels;Enviado;https://drive.google.com/open?id=1a-vT2c5v_f6Y6kDJSBcF8Ru8zHMjUrUZ&authuser=f215775%40dac.unicamp.br&usp=drive_fs;Live 26/01 - Por Dentro do Chora I
av332;Quando voce divide o projeto dessa forma seus arquivos ficam muito MAIS LEVES!;Áudio;Feed;Enviado;https://drive.google.com/open?id=1TQNhqTrNQOx4HiWqGzPdln0BQJ2wyjWC&authuser=f215775%40dac.unicamp.br&usp=drive_fs;Live 26/01 - Por Dentro do Chora I
av333;É dessa forma que varias pessoas projetam ao mesmo tempo no mesmo modelo usando o CHORA!;Áudio;IGTV;Enviado;https://drive.google.com/open?id=1YpWvdg2H_xeGVVmvTWMDVAZsJco1BCge&authuser=f215775%40dac.unicamp.br&usp=drive_fs;Live 26/01 - Por Dentro do Chora I
av334;Voce ainda aproveita pedaços de desenhos de outros projetos? Então está usando a Ferramenta ERRADA! ;Áudio;Feed;Enviado;https://drive.google.com/open?id=1ZreRw_xGZIP2ZdOjOTlKb0PtifMKNOaR&authuser=f215775%40dac.unicamp.br&usp=drive_fs;Live 26/01 - Por Dentro do Chora I
av335;Todo profissional de INTERIORES precisa saber  disso. Voce já sabe?;Áudio;Feed;Enviado;https://drive.google.com/open?id=1V2OUmV67nKqfeqQR-kdj7FpJ6eMS2u83&authuser=f215775%40dac.unicamp.br&usp=drive_fs;Live 26/01 - Por Dentro do Chora I
av336;Trabalha com INTERIORES  e Não sabe quanto custa sua HORA? Assista esse vídeo!;Áudio;Reels;Enviado;https://drive.google.com/open?id=1YhZ2Gm5UasHXbZcg6dzNaQoLgpKfGW53&authuser=f215775%40dac.unicamp.br&usp=drive_fs;Live 26/01 - Por Dentro do Chora I
av337;Se voce não incluiu estas atividades no valor do seu projeto, SAIU no PREJUIZO!;Áudio;Reels;Enviado;https://drive.google.com/open?id=1Vr5kQWI_yYAdYBr12fCk5JmYh33C7oeT&authuser=f215775%40dac.unicamp.br&usp=drive_fs;Live 26/01 - Por Dentro do Chora I
av340;É assim que voce ganha o cliente na apresentação de PROPOSTA do seu projeto de interiores!;Áudio;IGTV;Enviado;https://drive.google.com/open?id=1ZvJ9S4HNjTlY1p1_f81SUruwdh0LV266&authuser=f215775%40dac.unicamp.br&usp=drive_fs;Live 26/01 - Por Dentro do Chora I
v349;Se voce faz isso, esta FICANDO no PREJUIZO!;02:49 – 03:53;Feed;Enviado;https://drive.google.com/drive/folders/11wfgLe8Szu8_Dv2v2Y9J832g1AIq8bTD?usp=sharing;Live 21/03 - Checklist
v350;ATENÇAO: se voce nao cobra por essa etapa, esta PAGANDO PARA TRABALHAR!;04:05 – 05:41;IGTV;Enviado;https://drive.google.com/open?id=1spJeezCZVORpLpBf6e8JDVtBLpfGq3MT&authuser=f215775%40dac.unicamp.br&usp=drive_fs;Live 21/03 - Checklist
v351;Faça isso ANTES do cliente te CONTRATAR!;05:56 – 06:48;Feed;Enviado;https://drive.google.com/open?id=1gYmvc9pBMKuSV_jSBGjT0tVufhni42RS&authuser=f215775%40dac.unicamp.br&usp=drive_fs;Live 21/03 - Checklist
v352;Seu negocio, suas regras!;06:37 – 07:00;Reels;Enviado;https://drive.google.com/open?id=1q2KE_Mxb53DR9OwfjTNohAKJKqRn3BmB&authuser=f215775%40dac.unicamp.br&usp=drive_fs;Live 21/03 - Checklist
v353;Sem essas INFORMAÇOES seu cliente nao vera seu VALOR.;07:13 – 09:01;IGTV;Enviado;https://drive.google.com/drive/folders/1t1r2D5_9zBjGK9hBLUPRN-nhGUNhVLwM?usp=sharing;Live 21/03 - Checklist
v354;SEU CLIENTE tem essa duvida e NAO TE FALA.;07:25 – 08:45;IGTV;Enviado;https://drive.google.com/open?id=1vry75AI67OQGrjEzfBEks2qEo553U16l&authuser=f215775%40dac.unicamp.br&usp=drive_fs;Live 21/03 - Checklist
v355;Arquiteta e Designer, VOCE NAO FAZ PROJETOS!;09:14 – 09:57;Feed;Enviado;https://drive.google.com/drive/folders/1m51pgEiOQo8VHTlufOAtZnlwOmBx6Bui?usp=sharing;Live 21/03 - Checklist
v356;Arquiteta e designer, MOSTRE isso para o seu CLIENTE!;11:31 – 13:25;IGTV;Enviado;https://drive.google.com/drive/folders/1BMSTjFNVBLvxN-pl5G4uUJ0KpuyVCT_h?usp=sharing;Live 21/03 - Checklist
v357;É desse jeito que você PERDE o jogo ANTES de começar.;13:36 – 13:57;Reels;Enviado;https://drive.google.com/open?id=1rnR8hY5PlcAe5GwjGaLB_7r9ir_LbF_3&authuser=f215775%40dac.unicamp.br&usp=drive_fs;Live 21/03 - Checklist
v358;Fazer isso vai AUMENTAR suas chances de ser CONTRATADA!;16:29 – 17:37;IGTV;Enviado;https://drive.google.com/open?id=1x5Glnh5mrc5L41N4TIFniZnLUiyvsTy3&authuser=f215775%40dac.unicamp.br&usp=drive_fs;Live 21/03 - Checklist
v359; Ensine isso ao seu CLIENTE e aterrorize os CONCORRENTES! 🔥;17:37 – 18:12;Reels;Enviado;https://drive.google.com/file/d/1-yXko2788REU4JXFwxlg4-NqvsUPmlhq/view?usp=sharing;Live 21/03 - Checklist
v360;Esse é o PULO DO GATO na PRÉ-CONTRATAÇÃO;19:53 – 20:45;Feed;Enviado;https://drive.google.com/open?id=1-DuhKikSk2vdAN106tPc686hKoWvN3uz&authuser=f215775%40dac.unicamp.br&usp=drive_fs;Live 21/03 - Checklist
v361;Essa deve ser a BASE de todo Escritorio de Interiores;23:44 – 23:53;Reels;Enviado;https://drive.google.com/open?id=10186spXA0oJcl2l7BoTf7p14rmDZaT6Y&authuser=f215775%40dac.unicamp.br&usp=drive_fs;Live 21/03 - Checklist
v362;É VOCÊ que está pagando por esse TRABALHO!;32:45 – 33:03;Reels;Enviado;https://drive.google.com/open?id=101n_qlgiInq09LfyQ7s7mXy-DdWx0MME&authuser=f215775%40dac.unicamp.br&usp=drive_fs;Live 21/03 - Checklist
v363;É assim que se faz para mostrar VALOR ao CLIENTE!;33:39 – 34:12,  34:44 – 34:55;Feed;Enviado;https://drive.google.com/open?id=1-E9hZwE3q3fNZbDQDPp18cFkalAQFDp2&authuser=f215775%40dac.unicamp.br&usp=drive_fs;Live 21/03 - Checklist
v364;Por que seu CLIENTE deve CONTRATAR VOCE e nao seu CONCORRENTE?;35:14 – 37:09;IGTV;Enviado;https://drive.google.com/open?id=10xK4WNlW7Nwxx_h8s8zFTwPsS5EnGHmC&authuser=f215775%40dac.unicamp.br&usp=drive_fs;Live 21/03 - Checklist
v365;Faça isso e entregue o OURO para seu CONCORRENTE!;37:11 – 38:14;Feed;Enviado;https://drive.google.com/open?id=1-u2fsFrLrv4NIA6ElQGUDueAqFxdjnCp&authuser=f215775%40dac.unicamp.br&usp=drive_fs;Live 21/03 - Checklist
v366;Mostre isso ao seu CLIENTE e evite TRAGEDIAS (ainda maiores);42:20 – 43:13;Feed;Enviado;https://drive.google.com/open?id=1-HQiBDYapo4uFCAAUfueDBjMfmt1Y7w8&authuser=f215775%40dac.unicamp.br&usp=drive_fs;Live 21/03 - Checklist
av349;Se voce faz isso, esta FICANDO no PREJUIZO!;Áudio;Feed;Enviado;https://drive.google.com/file/d/1nzUMXDRFRvCqD0xCVg8Um1Zzrp_sastW/view?usp=sharing;Live 21/03 - Checklist
av350;ATENÇAO: se voce nao cobra por essa etapa, esta PAGANDO PARA TRABALHAR!;Áudio;IGTV;Enviado;https://drive.google.com/open?id=1sse_Cho_sOcbRq_exWfkF3keiEQf8oVf&authuser=f215775%40dac.unicamp.br&usp=drive_fs;Live 21/03 - Checklist
av351;Faça isso ANTES do cliente te CONTRATAR!;Áudio;Feed;Enviado;https://drive.google.com/file/d/1pvHtC0iAaVins-9Hx3Q5hA9RWwnHmIao/view?usp=sharing;Live 21/03 - Checklist
av352;Seu negocio, suas regras!;Áudio;Reels;Enviado;https://drive.google.com/open?id=1qCfwKde9QaeMwoHFWAFCVAp_jHRPXoZ_&authuser=f215775%40dac.unicamp.br&usp=drive_fs;Live 21/03 - Checklist
av353;Sem essas INFORMAÇOES seu cliente nao vera seu VALOR.;Áudio;IGTV;Enviado;https://drive.google.com/drive/folders/1T_aOy6k4JL3TIcouNW4FTQHcRLxgf9Kb?usp=sharing;Live 21/03 - Checklist
av354;SEU CLIENTE tem essa duvida e NAO TE FALA.;Áudio;IGTV;Enviado;https://drive.google.com/open?id=1wVAHwGSIDkir2LX6T74a0ifAbf6fUBZC&authuser=f215775%40dac.unicamp.br&usp=drive_fs;Live 21/03 - Checklist
av355;Arquiteta e Designer, VOCE NAO FAZ PROJETOS!;Áudio;Feed;Enviado;https://drive.google.com/file/d/1tgSyNQIdIQUyLXu1vhK8_vGUP0gFas2q/view?usp=sharing;Live 21/03 - Checklist
av356;Arquiteta e designer, MOSTRE isso para o seu CLIENTE!;Áudio;IGTV;Enviado;https://drive.google.com/drive/folders/1W7B3Q29t1MjxZ-szNkhZqjaSm69RX1sO?usp=sharing;Live 21/03 - Checklist
av357;É desse jeito que você PERDE o jogo ANTES de começar.;Áudio;Reels;Enviado;https://drive.google.com/open?id=1sG9kJy9fY3KO1YB8G7M4oq17dWqTVdKe&authuser=f215775%40dac.unicamp.br&usp=drive_fs;Live 21/03 - Checklist
av358;Fazer isso vai AUMENTAR suas chances de ser CONTRATADA!;Áudio;Feed;Enviado;https://drive.google.com/drive/folders/1NL-Q2RO6r31XM00lsJhYNkZdRrUnBxX6?usp=sharing;Live 21/03 - Checklist
av359; Ensine isso ao seu CLIENTE e aterrorize os CONCORRENTES! 🔥;Áudio;Reels;Enviado;https://drive.google.com/open?id=1y-UyEwEwAuh7Huldw6edtWpC4UFS2haM&authuser=f215775%40dac.unicamp.br&usp=drive_fs;Live 21/03 - Checklist
av360;Esse é o PULO DO GATO na PRÉ-CONTRATAÇÃO;Áudio;Feed;Enviado;https://drive.google.com/open?id=1yLfBvZ5avaTf_VM2GnQ3YuX7nN4cHMw-&authuser=f215775%40dac.unicamp.br&usp=drive_fs;Live 21/03 - Checklist
av361;Essa deve ser a BASE de todo Escritorio de Interiores;Áudio;Reels;Enviado;https://drive.google.com/open?id=1y_2QNbzvy3PRjg5X8I8ZvsXLNqkxnTPz&authuser=f215775%40dac.unicamp.br&usp=drive_fs;Live 21/03 - Checklist
av362;É VOCÊ que está pagando por esse TRABALHO!;Áudio;Reels;Enviado;https://drive.google.com/open?id=10CRLVszzPkZpeKZ240VVpWbtbBZCNgPG&authuser=f215775%40dac.unicamp.br&usp=drive_fs;Live 21/03 - Checklist
av363;É assim que se faz para mostrar VALOR ao CLIENTE!;Áudio;Feed;Enviado;https://drive.google.com/open?id=1zef5TEaEJeBiChJugBS1x1qhuvUaUC_p&authuser=f215775%40dac.unicamp.br&usp=drive_fs;Live 21/03 - Checklist
av364;Por que seu CLIENTE deve CONTRATAR VOCE e nao seu CONCORRENTE?;Áudio;IGTV;Enviado;https://drive.google.com/open?id=10zgY44zUo_5st5RyKm6hsjqO04DfYZpn&authuser=f215775%40dac.unicamp.br&usp=drive_fs;Live 21/03 - Checklist
av365;Faça isso e entregue o OURO para seu CONCORRENTE!;Áudio;Feed;Enviado;https://drive.google.com/open?id=1-qaUTum24HB0Ov-Yn2jmvGGolvVj3a5E&authuser=f215775%40dac.unicamp.br&usp=drive_fs;Live 21/03 - Checklist
av366;Mostre isso ao seu CLIENTE e evite TRAGEDIAS (ainda maiores);Áudio;Feed;Enviado;https://drive.google.com/open?id=1-8OOvcvuD5lNJVuIWwsZyGqaO5Ew3DtP&authuser=f215775%40dac.unicamp.br&usp=drive_fs;Live 21/03 - Checklist
v368;Descubra como inserir a iluminação no seu projeto executivo com um clique!;;Feed;Enviado;https://drive.google.com/open?id=17F9Rpi6-EwCUVGVCPouTfKAO7_A6gT9G&authuser=f215775%40dac.unicamp.br&usp=drive_fs;https://www.dropbox.com/s/930lkg8yz7yr3cr/CHORA%20em%20a%C3%A7%C3%A3o_ilumina%C3%A7%C3%A3o_inser%C3%A7%C3%A3o_1m26s.mp4?dl=0
v369;A mágica em ter uma biblioteca de símbolos ao projetar interiores!;;Feed;Enviado;https://drive.google.com/open?id=17wvrQsZFEk6QE-s-t0o-OIXU-DARxlel&authuser=f215775%40dac.unicamp.br&usp=drive_fs;https://www.dropbox.com/s/iod8yyi0hosmtin/CHORA%20em%20a%C3%A7%C3%A3o_ilumina%C3%A7%C3%A3o_s%C3%ADmbolos_1m8s.mp4?dl=0
v370;Isso é projetar de maneira automatizada!;;Feed;Enviado;https://drive.google.com/open?id=18Dq5O8-euQ-Irmki6wE2CnUozeI0n0x1&authuser=f215775%40dac.unicamp.br&usp=drive_fs;https://www.dropbox.com/s/xmbj18hfirtd9w3/CHORA%20em%20a%C3%A7%C3%A3o_scrapbook_tag_51s.mp4?dl=0
v371;Já imaginou ter tudo isso pronto na hora de gerar o EXECUTIVO?;;Feed;Enviado;https://drive.google.com/open?id=18Yih5mndSbB8HKgrbiXDMsJ52mg7GHZt&authuser=f215775%40dac.unicamp.br&usp=drive_fs;https://www.dropbox.com/s/kwaq339tqexhvz0/CHORA%20em%20a%C3%A7%C3%A3o_bancada_skp_56s.mp4?dl=0
v372;O Template CHORA Cad funciona para projetos na norma ABNT?;;Feed;Enviado;https://drive.google.com/open?id=18gqdJuyTURCz4gVUMrROGwIGP63jlf3C&authuser=f215775%40dac.unicamp.br&usp=drive_fs;https://www.dropbox.com/s/7ay13hf7yv97b1u/CHORA%20em%20a%C3%A7%C3%A3o_carimbo%20na%20vertical_45s.mp4?dl=0
v373;Veja como inserir automaticamente os carimbos nas suas pranchas técnicas!;;Feed;Enviado;https://drive.google.com/open?id=18qNjIUPU3GeFzpjGMDMCxAz8jH6qOjZG&authuser=f215775%40dac.unicamp.br&usp=drive_fs;https://www.dropbox.com/s/viw1unki5ving19/CHORA%20em%20a%C3%A7%C3%A3o_carimbo_adicionar%20p%C3%A1gina_1m12s.mp4?dl=0
v374;É aqui que começa a mágica do Template Chora Cad!;;IGTV;Enviado;https://drive.google.com/open?id=18ybnLJjWhb8pRkRZTCn0Gu6k4nLNSTsY&authuser=f215775%40dac.unicamp.br&usp=drive_fs;https://www.dropbox.com/s/l5zl4sqqqeog7cl/CHORA%20em%20a%C3%A7%C3%A3o_carimbo_nome%20da%20prancha_1m20s.mp4?dl=0
v375;Isso é projetar interiores de maneira INTELIGENTE!;;Feed;Enviado;https://drive.google.com/open?id=19CEZL7wJu2RqF3X2Yo1qPGtONOYUSYIX&authuser=f215775%40dac.unicamp.br&usp=drive_fs;https://www.dropbox.com/s/rjj6p0q6xy6qej0/CHORA%20em%20a%C3%A7%C3%A3o_cotas_cotando1_57s.mp4?dl=0
v376;Esse é o jeito para inserir cotas automatizadas no projeto de interiores;;IGTV;Enviado;https://drive.google.com/open?id=19DeTCo3MAmAYaHVy1BFHoanmUGPO73xX&authuser=f215775%40dac.unicamp.br&usp=drive_fs;https://www.dropbox.com/s/63n0ya0r8w9fr7p/CHORA%20em%20a%C3%A7%C3%A3o_cotas_cotando2_1m35s.mp4?dl=0
v377;Esse é a maneira mais rápida para detalhar seus projetos de interiores;;Feed;Enviado;https://drive.google.com/open?id=19U9RrTl6FhJA8PIm9GLZIkcIreqRLQ0h&authuser=f215775%40dac.unicamp.br&usp=drive_fs;https://www.dropbox.com/s/9xdhs3grb5xb0zm/CHORA%20em%20a%C3%A7%C3%A3o_detalhamento%20bancada_40s.mp4?dl=0
v378;Conheça as bibliotecas do Template Chora CAD!;;Feed;Enviado;https://drive.google.com/open?id=19YGIBdJ-1ObHwNFNQSFPwRMaKK8UcoU-&authuser=f215775%40dac.unicamp.br&usp=drive_fs;https://www.dropbox.com/s/eu9hl2iu3d5lq6o/CHORA%20em%20a%C3%A7%C3%A3o_scrapbook_apresenta%C3%A7%C3%A3o_57s.mp4?dl=0
v379;Projetando desse jeito, seu executivo fica pronto em 2 dias!;;Feed;Enviado;https://drive.google.com/open?id=19fgYRhEOXyIidbN8CowjScAUum73R_wV&authuser=f215775%40dac.unicamp.br&usp=drive_fs;https://www.dropbox.com/s/0mny0bacqlmcghl/CHORA%20em%20a%C3%A7%C3%A3o_scrapbook_el%C3%A9trica_1m2s.mp4?dl=0
v380;Suas legendas ao gerar o executivo são automatizadas? Não? Então veja isso!;;Feed;Enviado;https://drive.google.com/open?id=1A1OGkHevnk5-TDGhxBjww_3NsKpOr1E0&authuser=f215775%40dac.unicamp.br&usp=drive_fs;https://www.dropbox.com/s/kvlfe8i4r20piss/CHORA%20em%20a%C3%A7%C3%A3o_scrapbook_quadro%20de%20legenda_1m3s.mp4?dl=0
v381;SE Você trabalha com INTERIORES e vende TEMPO por que NÃO FAZ ISSO ainda?;11:38 – 12:21;Feed;Enviado;https://drive.google.com/open?id=1kntbmwXFitXL-V8YHE5_eMtSU1Ztxt_4&authuser=f215775%40dac.unicamp.br&usp=drive_fs;CH032021_ Live 2 Use esta fórmula 22/03
v382;Responda estas 3 PERGUNTAS e descubra se você  tem um negócio de INTERIORES que dá LUCRO!;21:02 – 21:47;Feed;Enviado;https://drive.google.com/open?id=1kum-MSbPaiASp_ExWTLX_CyRfIj0JPh-&authuser=f215775%40dac.unicamp.br&usp=drive_fs;CH032021_ Live 2 Use esta fórmula 22/03
v383;Se você troca TEMPO por Dinheiro, é isso que acontece!;27:59 – 28:11;Reels;Enviado;https://drive.google.com/open?id=1apPfT5gTeXs2PJfST1JAvA2fyAKlM-aX&authuser=f215775%40dac.unicamp.br&usp=drive_fs;CH032021_ Live 2 Use esta fórmula 22/03
v384;Arquiteta e Designer é isso o que acontece quando você cobra por M2;29:12 – 30:25;Feed;Enviado;https://drive.google.com/open?id=1kuqtY76MQbJGp2voGtVWEELw3w-5qqyi&authuser=f215775%40dac.unicamp.br&usp=drive_fs;CH032021_ Live 2 Use esta fórmula 22/03
v385;Como AUMENTAR seu LUCRO mensal trabalhando com INTERIORES?;31:38 – 32:10;Reels;Enviado;https://drive.google.com/open?id=1bGfDHb34W8IERCoOCzQVE2137m6U3z-j&authuser=f215775%40dac.unicamp.br&usp=drive_fs;CH032021_ Live 2 Use esta fórmula 22/03
v386;Arquiteta e designer, Anote essas 2 formas de FATURAR além de fazer PROJETOS!;32:10 – 33:02;Feed;Enviado;https://drive.google.com/open?id=1gngw0U3GA3T8my04ym3PUzF8lNez_4St&authuser=f215775%40dac.unicamp.br&usp=drive_fs;CH032021_ Live 2 Use esta fórmula 22/03
v387;O que uma LOJA DE SAPATOS e um ESCRITÓRIO DE INTERIORES têm em comum?;33:23 – 34:44;Feed;Enviado;https://drive.google.com/open?id=1eS0HdNTiGABmas-90oKDR1uv53JP2VIX&authuser=f215775%40dac.unicamp.br&usp=drive_fs;CH032021_ Live 2 Use esta fórmula 22/03
v388;"Arquiteta e Designer, ESSE é o seu verdadeiro ""PRODUTO""!";34:46 – 35:06;Reels;Enviado;https://drive.google.com/open?id=1bttNo8X0dWzZlkjHsKwLV9MklQwfCKPw&authuser=f215775%40dac.unicamp.br&usp=drive_fs;CH032021_ Live 2 Use esta fórmula 22/03
v389;3 MANEIRAS para AUMENTAR seus GANHOS com PROJETOS DE INTERIORES!;35:27 – 35:47, 35:58 – 36:10,  36:54 – 37:32,  38:17 – 38:35;IGTV;Enviado;https://drive.google.com/open?id=1kvRCXTBV8ktuB92yRiyfGUbukROmxcFp&authuser=f215775%40dac.unicamp.br&usp=drive_fs;CH032021_ Live 2 Use esta fórmula 22/03
v390;É Por isso que voce precisa MAPEAR as etapas do PROJETO de INTERIORES!;36:31 – 36:43;Reels;Enviado;https://drive.google.com/open?id=1cKFPk40-_UyTv18I3q7nJyWdNtWBl6XY&authuser=f215775%40dac.unicamp.br&usp=drive_fs;CH032021_ Live 2 Use esta fórmula 22/03
v391;Essa é a solução para concluir seu PROJETO EXECUTIVO 5x mais rápido!;37:57 – 38:13;Reels;Enviado;https://drive.google.com/open?id=1cecv_cj7U6wmao9DsSOGMuWFUsuwl3HD&authuser=f215775%40dac.unicamp.br&usp=drive_fs;CH032021_ Live 2 Use esta fórmula 22/03
v392;NÃO adianta ter um escritório de interiores PRODUTIVO se não tiver ISSO!;38:40 – 39:27;Feed;Enviado;https://drive.google.com/open?id=1l9PYCypGuUd0ow174GzV67wyKdVzSqJf&authuser=f215775%40dac.unicamp.br&usp=drive_fs;CH032021_ Live 2 Use esta fórmula 22/03
v393;Essas são as FERRAMENTAS que todo profissional de INTERIORES deve INVESTIR  para AUMENTAR seu FATURAMENTO ;40:35 – 41:50;IGTV;Enviado;https://drive.google.com/open?id=1lBt7AYBbsoNiZRgolD136AV_0CNYQTCD&authuser=f215775%40dac.unicamp.br&usp=drive_fs;CH032021_ Live 2 Use esta fórmula 22/03
v394;Arquiteta e Designer, você sabe como COMPRAR mais TEMPO?;42:03 – 43:46;Feed;Enviado;https://drive.google.com/open?id=1lCfrVG5iLPKEJX8ujQ_pMh2dUvRopxhp&authuser=f215775%40dac.unicamp.br&usp=drive_fs;CH032021_ Live 2 Use esta fórmula 22/03
v395;4 AÇÕES para ter um escritório de interiores mais LUCRATIVO!;45:15 – 45:39;Reels;Enviado;https://drive.google.com/open?id=1dosk2G2oUA4QeBsk1k7ZJ6gxkaT8Tj1C&authuser=f215775%40dac.unicamp.br&usp=drive_fs;CH032021_ Live 2 Use esta fórmula 22/03
v396;Arquiteta e Designer, antes de CONTRATAR voce precisa saber ISSO!;46:10 – 46:54;Feed;Enviado;https://drive.google.com/open?id=1lWAN0wreHY9ZgMnClt7kvCjgYurql-g-&authuser=f215775%40dac.unicamp.br&usp=drive_fs;CH032021_ Live 2 Use esta fórmula 22/03
v397;5 LIÇÕES para LUCRAR mais com seu ESCRITÓRIO DE INTERIORES!;47:18 – 48:32;IGTV;Enviado;https://drive.google.com/open?id=1lGI-89GDWZcnLlbQ9UZ-XAgwfEXpik6Y&authuser=f215775%40dac.unicamp.br&usp=drive_fs;CH032021_ Live 2 Use esta fórmula 22/03
v398;Você sabe quantas HORAS PRODUTIVAS tem seu ESCRITÓRIO DE INTERIORES?;56:49 – 58:41;IGTV;Enviado;https://drive.google.com/open?id=1lLIbk0SVLpXSsw-qEeG4yxL-tF3thyqT&authuser=f215775%40dac.unicamp.br&usp=drive_fs;CH032021_ Live 2 Use esta fórmula 22/03
v399;Essa é a diferença entre um NEGÓCIO de INTERIORES MAIS LUCRATIVO X  Menos Lucrativo;01:00:13 – 01:00:45;Reels;Enviado;https://drive.google.com/open?id=1jEC8E83Lc2Mddqk64KIJuUBFtOVqV_E6&authuser=f215775%40dac.unicamp.br&usp=drive_fs;CH032021_ Live 2 Use esta fórmula 22/03
v400;Se você é DONA de um ESCRITÓRIO DE INTERIORES, isso é SUA RESPONSABILIDADE!;01:00:54 – 01:01:36;Feed;Enviado;https://drive.google.com/open?id=1lLQBZ1fx8G0Pf7fOxyoHA_AmID20LfM5&authuser=f215775%40dac.unicamp.br&usp=drive_fs;CH032021_ Live 2 Use esta fórmula 22/03
v401;É assim que você CALCULA as HORAS PRODUTIVAS dos seus ESTAGIÁRIOS!;01:01:59 – 01:03:16;IGTV;Enviado;https://drive.google.com/open?id=1lTZ0OiMcT50tybEscMxcg-pYjBtlbrxb&authuser=f215775%40dac.unicamp.br&usp=drive_fs;CH032021_ Live 2 Use esta fórmula 22/03
v402;O seu ESCRITÓRIO não gira em torno de PROJETO, ele gira em torno DISSO!;01:03:45 – 01:05:27;IGTV;Enviado;https://drive.google.com/open?id=1lVQRBKWZrIWrx93UPNbaz02dLsHA1YS3&authuser=f215775%40dac.unicamp.br&usp=drive_fs;CH032021_ Live 2 Use esta fórmula 22/03
av381;SE Você trabalha com INTERIORES e vende TEMPO por que NÃO FAZ ISSO ainda?;11:38 – 12:21;Feed;Enviado;https://drive.google.com/open?id=1m0EyWsK8XM4SVKKW9W7bvoSZG2HgrPb0&authuser=f215775%40dac.unicamp.br&usp=drive_fs;CH032021_ Live 2 Use esta fórmula 22/03
av382;Responda estas 3 PERGUNTAS e descubra se você  tem um negócio de INTERIORES que dá LUCRO!;21:02 – 21:47;Feed;Enviado;https://drive.google.com/open?id=1a_9-cUXmDArmTADYTMm5B8k54FXtURrg&authuser=f215775%40dac.unicamp.br&usp=drive_fs;CH032021_ Live 2 Use esta fórmula 22/03
av383;Se você troca TEMPO por Dinheiro, é isso que acontece!;27:59 – 28:11;Reels;Enviado;https://drive.google.com/open?id=1b31wS0D7GjQvvVbMd1CjX5plBIOtY1gw&authuser=f215775%40dac.unicamp.br&usp=drive_fs;CH032021_ Live 2 Use esta fórmula 22/03
av384;Arquiteta e Designer é isso o que acontece quando você cobra por M2;29:12 – 30:25;Feed;Enviado;https://drive.google.com/open?id=1eLKfn93jGEehbnbJVwpbnQtz2s_o74y_&authuser=f215775%40dac.unicamp.br&usp=drive_fs;CH032021_ Live 2 Use esta fórmula 22/03
